id,ori_text,ori_label,pattern,highlight
ss229,i went by around 1:30p on a friday and there were still plenty of tables available even though they were busy and had nice outdoor seating as well . ,environment,"plenty of tables available, nice outdoor seating","[[['plenty of tables available']], [['nice outdoor seating']]]"
ss132,"outdoor patio with cute lights , gazebos . belly dancers , hooka , music . ",environment,"outdoor patio, cute lights, gazebos","[[['outdoor patio']], [['cute lights']], [['gazebos']]]"
ss464,"service was awful , bathrooms were filthy and wellesley 's stupid blue law about requiring every patron to order food while drinking is absurb . ",environment,bathrooms were filthy,[[['bathrooms were filthy']]]
ss479,"there 's nothing striking about the environment or decor here , but do not leave without trying the dried , sautéed green beans ",environment,environment or decor,[[['environment or decor']]]
ss261,the location is spacious and there are lots of car on display to view and sit inside . ,environment,"location is spacious, lots of car on display","[[['location is spacious']], [['lots of car on display']]]"
ss45,"gorgeous , gorgeous , gorgeous interior design , with small outdoor area . ",environment,"interior design, small outdoor area","[[['interior design']], [['small outdoor area']]]"
ss108,i felt like i was at a fine dining establishment . ,environment,fine dining establishment,[[['fine dining establishment']]]
ss181,really nice . quiet . reliably friendly . inexpensive . a place to think or reconnect with good friends . patio can be hot . great waitress . ,environment,"quiet, patio can be hot, really nice","[[['quiet']], [['patio can be hot']], [['really nice']]]"
ss369,the setting is awesome with a lodgelike setting . ,environment,"setting is awesome, lodgelike setting","[[['setting is awesome']], [['lodgelike setting']]]"
ss404,very well ran and maintained museum . take your time and take everything in . some beautiful things await you here ! ,environment,well ran and maintained museum,[[['well ran and maintained museum']]]
ss272,"nice open , clean and crisp atmosphere ",environment,"open, clean and crisp atmosphere","[[['open']], [['clean and crisp atmosphere']]]"
ss109,great americano and according to wife great ambiance . sandwiches looked tasty but we had already eaten . cannoli was a great treat . ,environment,great ambiance,[[['great ambiance']]]
ss152,i really enjoyed   non - sarcastically   having an overpriced drink here because it reminded me of new york . ,environment,reminded me of new york,[[['reminded me of new york']]]
ss83,overrated crowded just okay . the staff was no where to be found when something was needed water glasses always empty will not return here . ,environment,"overrated crowded, water glasses always empty","[[['overrated crowded']], [['water glasses always empty']]]"
ss119,2 pitchers of   sam adams   beer $ 50 . i like the dive vibe but that is unheard of even for the financial district . ,environment,dive vibe,[[['dive vibe']]]
ss299,locker rooms are always dirty especially the bathrooms . often on weekends the stalls are out of toilet paper hair balls under the equipment on the floor which are still there a month later ..... ,environment,"locker rooms are always dirty, bathrooms, stalls are out of toilet paper","[[['locker rooms are always dirty']], [['bathrooms']], [['stalls are out of toilet paper']]]"
ss353,great place for families ! clean safe and fun for all ages ! ! ,environment,"clean safe, great place for families","[[['clean safe']], [['great place for families']]]"
ss234,lots of outdoor seating as well . ,environment,lots of outdoor seating,[[['lots of outdoor seating']]]
ss274,the interior is clean and has an almost perfect health rating ,environment,"interior is clean, almost perfect health rating","[[['interior is clean']], [['almost perfect health rating']]]"
