id,ori_text,ori_label,pattern,highlight
ss278871,i feel as if i would have enjoyed going to school with the author and would have liked to be her friend,love,liked to be her friend,[[['liked to be her friend']]]
ss188962,i also feel your hot body against mine,love,,[]
ss366748,i lost a few people which i hate because i have a really hard time letting go of people to whom i feel loyal,love,feel loyal,[[['feel loyal']]]
ss21003,i feel so loved and lucky and happy to get to celebrate these momentous occasions,love,feel so loved,[[['feel so loved']]]
ss17565,i feel like if meg had more room to grow the character i wouldve liked him better than having him simply propped by jon and creepy,love,,[]
ss47914,im usually so strong but she has this ability to make me feel like a naughty child that doesnt know what shes talking about,love,,[]
ss230420,i hope it feels supportive to you,love,,[]
ss123711,i feel club athletes are not supporting this national event this year is because of the totally change of the course from last year,love,,[]
ss394082,i sort of got the feeling that i had stepped into the mind of a romantic smoking pot,love,romantic,[[['romantic']]]
ss254286,i grew to feel fond of lena despite the fact that there still seemed to be nothing particularly stand out about her,love,feel fond of,[[['feel fond of']]]
ss291262,i still feel that way but im much more sympathetic to her now that im older,love,,[]
ss178398,i was viewed as one of the team leaders there was something about what he said and how he said it that led me to feel that he genuinely liked me,love,genuinely liked me,[[['genuinely liked me']]]
ss255928,i feel as though im not really caring for anyone right now in any sense really so im feeling kinda down,love,caring for anyone,[[['caring for anyone']]]
ss263488,i feel a little tender tonight,love,feel a little tender,[[['feel a little tender']]]
ss279452,i truly feel passionate about literacy and writing skills and imagination and combined mental emotional growth through the written word,love,truly feel passionate about,[[['truly feel passionate about']]]
ss259462,i feel your gentle breath on my cheek as i tend to my potted plants and sit on my porch,love,your gentle breath on my cheek,[[['your gentle breath on my cheek']]]
ss63396,im not feeling particularly generous,love,,[]
ss173842,i really feel the most compassionate about and am drawn to the shared secrets where the undertone is guilt,love,"feel the most compassionate about, am drawn to","[[['feel the most compassionate about']], [['am drawn to']]]"
ss206772,i said i cant help but feel sympathetic towards someone who is alone even if its their fault,love,,[]
ss302710,i kept feeling it and loving it,love,loving it,[[['loving it']]]
ss306742,i instantly feel warmth caring and a hint of a smile,love,feel warmth caring,[[['feel warmth caring']]]
ss73499,i feel more than ever a longing for the christs return,love,longing for,[[['longing for']]]
ss265553,i can be very good he murmurs against her neck sliding a hand underneath her skirt and feeling the garters with gentle teasing fingertips though it seems that you re the one having some trouble with that now,love,"murmurs against her neck, gentle teasing fingertips","[[['murmurs against her neck']], [['gentle teasing fingertips']]]"
ss209757,i realized it was all confused with the feeling that they were really like beloved brothers,love,beloved brothers,[[['beloved brothers']]]
ss244147,i feel is comfort a gentle blanket of left over love on a brilliantly sunny and unnaturally quiet day perhaps to offer me a clarity that only stillness provides,love,"left over love, gentle blanket of left over love","[[['left over love']], [['gentle blanket of left over love']]]"
ss101918,i feel for those who loves someone but never loved back,love,"loves someone, never loved back","[[['loves someone']], [['never loved back']]]"
ss347006,im that person who feels passionate about everything,love,feels passionate about everything,[[['feels passionate about everything']]]
ss43402,i feel about how i was then but fond memories taking limited supplies and trying to decorate for a theme smiling enthusiastically as year olds stumbled through memory verses cheering as they played a group game with not much point but lots of running,love,fond memories,[[['fond memories']]]
ss372673,i didnt post them as for the most part i feel sympathetic to the gay people i know and find them gentle and kind,love,"feel sympathetic to, find them gentle and kind","[[['feel sympathetic to']], [['find them gentle and kind']]]"
ss12659,i feel a sense of longing when i hear about places and times like these,love,sense of longing,[[['sense of longing']]]
ss212932,i desert on tame camels and then feeling very nervous being so close to wild camels a href http averytoday,fear,feeling very nervous,[[['feeling very nervous']]]
ss289038,i feel less intimidated by the strident criticisms,fear,less intimidated,[[['less intimidated']]]
ss37784,i feel that i am less timid about others reading the things that i have written which allows me to be more confident in my writing,fear,less timid,[[['less timid']]]
ss379965,i officials feel americans need to be shaken awake,fear,shaken awake,[[['shaken awake']]]
ss185540,i feel overwhelmed when i see my son more than my daughter relish his meals whenever he spots a piece of fried pomfret or kingfish in his plate,fear,feel overwhelmed,[[['feel overwhelmed']]]
ss188518,im able to deal with the crazy without feeling vulnerable a few weeks before due date or while caring for a newborn,fear,feeling vulnerable,[[['feeling vulnerable']]]
ss188220,i notice is that there a several spelling mistakes early on which makes me feel a little sceptical about someone who professes to make millions by writing,fear,feel a little sceptical,[[['feel a little sceptical']]]
ss229588,im sick of the feeling that remains in your heart chest after youve just been startled,fear,been startled,[[['been startled']]]
ss388703,when we forced a friend to chew a poisonous herb in primary school his tongue was swollen and he told his mother about it the mother reported it to the headmaster who threatened to expel us,fear,threatened to expel us,[[['threatened to expel us']]]
ss335115,i want to feel indecisive and confused my mind really lets loose,fear,feel indecisive and confused,[[['feel indecisive and confused']]]
ss28525,i feel inhibited because of my weight,fear,feel inhibited,[[['feel inhibited']]]
ss247991,i was feeling pretty apprehensive,fear,feeling pretty apprehensive,[[['feeling pretty apprehensive']]]
ss321612,i see so many other people having trouble dealing with their lives and believe it or not feel distressed about this,fear,feel distressed,[[['feel distressed']]]
ss242139,i am still feeling shaky and unnerved by the entire situation,fear,"feeling shaky, unnerved","[[['feeling shaky']], [['unnerved']]]"
ss8103,i also do not feel distressed but mixer is one of kitchen enginery that i like most,fear,not feel distressed,[[['not feel distressed']]]
ss165580,i woke up still u feeling unreasonably paranoid,fear,feeling unreasonably paranoid,[[['feeling unreasonably paranoid']]]
ss208191,i really feel it will absolutely agitated a mom or father that will get informed in the pediatrician they really should spend in total for just about any possible doctor visits,fear,agitated,[[['agitated']]]
ss290250,i feel awfully uncomfortable about going away said the girl in a troubled voice,fear,"feel awfully uncomfortable, troubled voice","[[['feel awfully uncomfortable']], [['troubled voice']]]"
ss342264,i still feel its a little shaky at times and can move into the slightly odd jades hair in particular seems prone to this but generally it works well with spencers writing,fear,a little shaky,[[['a little shaky']]]
ss276337,i used to feel a little bit anxious about running with my husband he runs faster than i do and i worried that id hold him back or that id do myself a mischief trying to keep up with him,fear,"feel a little bit anxious, worried","[[['feel a little bit anxious']], [['worried']]]"
ss297753,i just feel overwhelmed with this parenting gig,fear,overwhelmed,[[['overwhelmed']]]
ss96587,i feel only a little agitated right now,fear,agitated,[[['agitated']]]
ss94649,i did not feel pressured to be anything but honest in my response to his work,fear,pressured,[[['pressured']]]
ss281234,im forced to stay where im currently living i dont want to but due to custody issues i might have to i will be even more alone than i already feel the one thing that ive been afraid of all my life is slowly happening and its all my fault,fear,"forced to stay, afraid of all my life, all my fault","[[['forced to stay']], [['afraid of all my life']], [['all my fault']]]"
ss48793,i remember feeling startled at its complexity and intricacy,fear,startled,[[['startled']]]
ss153484,i could feel a suspicious expression involuntarily creep across my face,fear,suspicious expression,[[['suspicious expression']]]
ss369848,i understand that this is an ongoing effect of the transference i developed and even though i feel i have shaken most of it off me some of it still remains,fear,some of it still remains,[[['some of it still remains']]]
ss44737,i am about to go to johannesburg which is more vigorous urban alive and i m feeling timid,fear,feeling timid,[[['feeling timid']]]
ss306249,i feel so insecure i know that i just need you like ive never done before,fear,feel so insecure,[[['feel so insecure']]]
ss157506,i feel frantic to push to the front of the stage so people believe that i m okay and well formed,fear,feel frantic,[[['feel frantic']]]
ss293868,i have run figures and it all works out great on paper but we are still waiting and it makes my insides feel shaky and i get nervous,fear,"insides feel shaky, get nervous","[[['insides feel shaky']], [['get nervous']]]"
ss351204,i started to feel suspicious that my sisters were talking about me,fear,feel suspicious,[[['feel suspicious']]]
ss162569,i wasnt so sure how i would feel about it as i was afraid it might be too straight on me but with a factory store somewhat close to me i figured i might as well try it out,fear,was afraid,[[['was afraid']]]
ss306141,i feel it means the director is indecisive and is looking for inspiration within someone elses work,fear,indecisive,[[['indecisive']]]
ss263120,i fully expected to feel nervous panic impatience scared etc,fear,"feel nervous, panic, scared","[[['feel nervous']], [['panic']], [['scared']]]"
ss246911,i feel paranoid that i have burnt a bridge with her mother with whom i have hitherto had a good relationship,fear,"feel paranoid, burnt a bridge","[[['feel paranoid']], [['burnt a bridge']]]"
ss408215,im feeling very indecisive at the moment,fear,feeling very indecisive,[[['feeling very indecisive']]]
ss96288,i definitely found that admitting not only to myself but out loud and to my family that i was feeling helpless and ineffective was enough to take the bigness out of my feelings of disconnection and failure,fear,"feeling helpless, ineffective, feelings of disconnection and failure","[[['feeling helpless']], [['ineffective']], [['feelings of disconnection and failure']]]"
ss208786,i feel hesitant to do it since i don t have any experience with programming and all,fear,feel hesitant,[[['feel hesitant']]]
ss390668,i feel vulnerable because i can t relate to their culture and have no idea how my presence will affect a community,fear,"feel vulnerable, no idea how my presence will affect","[[['feel vulnerable']], [['no idea how my presence will affect']]]"
ss396908,i feel slightly uncomfortable discussing this for fear that some reader will think me wasteful and overly particular,fear,"for fear that, uncomfortable","[[['for fear that']], [['uncomfortable']]]"
ss181313,i no longer feel distraught,fear,feel distraught,[[['feel distraught']]]
ss203537,i feel frightened that i allowed that to happen,fear,feel frightened,[[['feel frightened']]]
ss116740,i feel a bit intimidated by that,fear,feel intimidated,[[['feel intimidated']]]
ss212400,i find it impossible to explain exactly why i m feeling so restless,fear,feeling so restless,[[['feeling so restless']]]
ss388883,i definitely feel on edge around people but im at least as afraid that i will screw things up as i am that they will,fear,"feel on edge, afraid that i will screw things up","[[['feel on edge']], [['afraid that i will screw things up']]]"
ss98336,i feel reluctant to go out of the house without putting anything on the face,fear,feel reluctant,[[['feel reluctant']]]
ss140108,i feel too overwhelmed to start a new project if my space is upside down so once im done everything goes back into its place ready for the next time,surprise,,[]
ss204717,i actually feel amazing,surprise,feel amazing,[[['feel amazing']]]
ss240201,i could be in here for up to a week again and given how i feel at the moment i wouldnt be surprised if it is that long,surprise,wouldn't be surprised,"[[[""wouldn't be surprised""]]]"
ss381451,im feeling pretty impressed with this early nile stuff,surprise,feeling pretty impressed,[[['feeling pretty impressed']]]
ss15024,im once again an amoeba of a being who instead of understanding our national currency system and the logistics of a grocery store chews on the dollar bills because they feel funny in your mouth,surprise,,[]
ss324141,i do have a feeling there will be a shocked look on someone s face when i arrive in way too many hours and that it will result into going to ikea to get a massive storage system,surprise,shocked look on someone s face,[[['shocked look on someone s face']]]
ss263726,i feel like the amazing opportunities afford to both jay and i have both pushed us towards success and left us entirely unsure about how to find a career we can make a living with and be happy,surprise,,[]
ss364856,im feeling this funny tickle in my gut that is suggesting ever so kindly that i need a plan,surprise,,[]
ss148984,i have this crazy feeling that no one cares or theyll think im weird for thinking certain things or saying certain things,surprise,,[]
ss118086,i now peruse the stand quite regularly and have bought a few items which have left me feeling quite impressed,surprise,feeling quite impressed,[[['feeling quite impressed']]]
ss141232,i have seen the image of this entryway pop up so many times i feel surprised that i didnt stumble upon it before,surprise,"feel surprised, didnt stumble upon it before","[[['feel surprised']], [['didnt stumble upon it before']]]"
ss74093,i covered myself from feeling too overwhelmed by the idea by going into partnership with a friend,surprise,,[]
ss25711,i feel amazed the persons who lives with me full of the day nd they feel i m very egostic,surprise,feel amazed,[[['feel amazed']]]
ss191812,i feel like i am repeating myself but i continue to be amazed that folks from church work karate and scouts not only offer their help but in many cases do so with a certain forcefulness that moves me to speechlessness which for those of you who know me is quite a feat,surprise,"continue to be amazed, moves me to speechlessness","[[['continue to be amazed']], [['moves me to speechlessness']]]"
ss134857,i feel ever so slightly dazed as i have to make the short walk from one chair to another,surprise,dazed,[[['dazed']]]
ss231824,i think it would be a very interesting topic because i feel that a lot of people are also curious,surprise,,[]
ss139287,i can feel the shocked around him too at that very moment,surprise,feel the shocked,[[['feel the shocked']]]
